Full Name,Name,Status,Duration,Error,Stack Trace,Steps,Parent Suite,Suite,Sub Suite,Epic,Feature,Story
"tests.test_mcp_tools#test_mcp_pipeline_execute_false_by_default","MCP pipeline defaults to dry-run when execute is omitted","passed","7ms",,,"Call greedy_token_pipeline without execute flag passed (7ms)
  pipeline dry-run response: Pipeline: search baseUrl path=sample.js then rag baseUrl | Steps: 2 | ── Step 1/2: search: baseUrl in sample.js [tool/dry-run] OK · 0ms · ~0 tok | (dry-run) search 'baseUrl' in sample.js | ── Step 2/2: rag: baseUrl [rag/dry-run] OK · 0ms... passed (0s)
 Verify dry-run (no real step execution) passed (0s)","MCP","MCP tools",,"MCP","MCP tools","Pipeline tool"
"tests.test_mcp_tools#test_mcp_pipeline_dry_run_includes_footer","MCP pipeline dry-run includes per-step Greedy token footer","passed","7ms",,,"Call greedy_token_pipeline dry-run passed (7ms)
  pipeline response: Pipeline: check-meta-sync then rag baseUrl | Steps: 2 | ── Step 1/2: check-meta-sync [python/dry-run] OK · 0ms · ~0 tok | (dry-run) cd /tmp/pytest-of-runner/pytest-0/test_mcp_pipeline_dry_run_incl0 && ./scripts/check-meta-sync.sh | ── St... passed (0s)
 Verify per-step savings footer passed (0s)","MCP","MCP tools",,"MCP","MCP tools","Pipeline tool"
"tests.test_mcp_tools#test_mcp_pipeline_execute_true","MCP pipeline execute=true runs allowlisted search+rag (not mock-only)","passed","20ms",,,"Call greedy_token_pipeline with execute=true passed (19ms)
  pipeline execute response: Pipeline: search baseUrl path=sample.js then rag baseUrl | Steps: 2 | ── Step 1/2: search: baseUrl in sample.js [tool/ran] OK · 5ms · ~0 tok | Search: 'baseUrl' in projects/sample.js | 1:const baseUrl = 'http://localhost'; | ── Step 2/2:... passed (0s)
 Verify steps ran and footer is present passed (0s)","MCP","MCP tools",,"MCP","MCP tools","Pipeline tool"
"tests.test_mcp_tools#test_mcp_pipeline_list_recipes","MCP pipeline list returns named recipes","passed","3ms",,,"Call greedy_token_pipeline list passed (3ms)
  pipeline list response: Named pipelines: | meta-audit | Python meta check → Ollama skill audit | steps: check-meta-sync → audit-skill {skill} | usage: pipeline: meta-audit <args> | meta-rag | Python meta check → RAG lookup | steps: check-meta-sync → rag {query}... passed (0s)
 Verify named recipes are listed passed (0s)","MCP","MCP tools",,"MCP","MCP tools","Pipeline tool"
"tests.test_security#test_mcp_pipeline_dry_run_by_default","MCP pipeline tool is dry-run by default","passed","3ms",,,"Call greedy_token_pipeline without execute flag passed (2ms)
  execute kwarg: False passed (0s)
 Verify dry-run by default passed (0s)","Security","Shell quoting",,"Security","Shell quoting","MCP safety"
"tests.test_mcp_tools#test_mcp_rag_returns_hits_with_footer","MCP RAG tool returns hits with Greedy token footer","passed","30ms",,,"Call greedy_token_rag passed (30ms)
  rag response: RAG hits for: baseUrl -D flag | 1. [test-baseurl] score=4.0  (config) | docs/rag/config/test-chunk.md | baseUrl is configured via -DbaseUrl flag in Gradle. | --- | --- | Greedy token | This call | Executor: rag — docs/rag chunk read | Ro... passed (0s)
 Verify RAG hits and Greedy token footer passed (0s)","MCP","MCP tools",,"MCP","MCP tools","RAG tool"
"tests.test_budget#test_wrap_mcp_response_appends_footer","MCP response wrapper appends Greedy token footer","passed","27ms",,,"Wrap MCP response with Greedy token footer passed (27ms)
  wrapped response: result line | --- | Greedy token | This call | Executor: rg — ripgrep on disk | Route: mcp-search | Spent (MCP executor, LLM tokens): ~0  (ripgrep on disk — 0 LLM spend) | Billing: free tier — not expensive LLM | Cursor agent chat (naive... passed (0s)
 Verify footer is appended passed (0s)","Greedy token","Token budget",,"Greedy token","Token budget","MCP response"
"tests.test_mcp_tools#test_mcp_route_includes_greedy_token_footer","MCP route tool returns tier decision with Greedy token footer","passed","56ms",,,"Call greedy_token_route passed (55ms)
  route response: Task: find baseUrl in sample.js | Route: TOOL  (tool-rg-search, 59%) | Complexity: low | Est. tokens: 0 | Rationale: Mechanical search — ripgrep/jq, zero LLM tokens. 0 tokens — ripgrep before RAG/Cursor | Matched: find | Command: cd /tmp... passed (0s)
 Verify tool route and Greedy token footer passed (0s)","MCP","MCP tools",,"MCP","MCP tools","Route tool"
"tests.test_mcp_tools#test_mcp_search_finds_match_in_workspace","MCP search tool finds matches and appends Greedy token footer","passed","36ms",,,"Call greedy_token_search passed (36ms)
  search response: Search: 'baseUrl' in projects/sample.js | 1:const baseUrl = 'http://localhost'; | --- | Greedy token | This call | Executor: rg — ripgrep on disk | Route: mcp-search | Duration: 5 ms | Spent (MCP executor, LLM tokens): ~0  (ripgrep on di... passed (0s)
 Verify match and Greedy token footer passed (0s)","MCP","MCP tools",,"MCP","MCP tools","Search tool"
"tests.test_mcp_icon#test_mcp_icons_advertises_png_data_uri","MCP server icon advertises PNG data URI for Cursor","passed","1ms",,,"Load MCP server icons passed (1ms)
  icon metadata: [ | { | ""mimeType"": ""image/png"", | ""sizes"": [ | ""any"" | ], | ""src_length"": 368754 | } | ] passed (0s)
 Verify PNG data URI icon for Cursor passed (0s)","MCP","Server icon",,"MCP","Server icon","SEP-973 icon"
"tests.test_mcp_stdio#test_mcp_stdio_pipeline_dry_run_footer","MCP stdio pipeline dry-run includes per-step Greedy token footer","passed","779ms",,,"Call greedy_token_pipeline dry-run via MCP stdio passed (779ms)
  pipeline response: Pipeline: check-meta-sync then rag baseUrl | Steps: 2 | ── Step 1/2: check-meta-sync [python/dry-run] OK · 0ms · ~0 tok | (dry-run) cd /tmp/pytest-of-runner/pytest-0/test_mcp_stdio_pipeline_dry_ru0 && ./scripts/check-meta-sync.sh | ── St... passed (0s)
 Verify per-step savings footer passed (0s)","MCP","MCP stdio server",,"MCP","MCP stdio server","Pipeline tool"
"tests.test_mcp_stdio#test_mcp_stdio_pipeline_execute_true","MCP stdio pipeline execute=true runs allowlisted search+rag (not mock-only)","passed","797ms",,,"Call greedy_token_pipeline with execute=true via MCP stdio passed (796ms)
  pipeline execute response: Pipeline: search baseUrl path=sample.js then rag baseUrl | Steps: 2 | ── Step 1/2: search: baseUrl in sample.js [tool/ran] OK · 5ms · ~0 tok | Search: 'baseUrl' in projects/sample.js | 1:const baseUrl = 'http://localhost'; | ── Step 2/2:... passed (0s)
 Verify steps ran and footer is present passed (0s)","MCP","MCP stdio server",,"MCP","MCP stdio server","Pipeline tool"
"tests.test_mcp_stdio#test_mcp_stdio_rag_returns_hits","MCP stdio RAG tool returns doc hits with Greedy token footer","passed","804ms",,,"Call greedy_token_rag via MCP stdio passed (802ms)
  rag response: RAG hits for: baseUrl -D flag | 1. [test-baseurl] score=4.0  (config) | docs/rag/config/test-chunk.md | baseUrl is configured via -DbaseUrl flag in Gradle. | --- | --- | Greedy token | This call | Executor: rag — docs/rag chunk read | Ro... passed (0s)
 Verify RAG hits and Greedy token footer passed (0s)","MCP","MCP stdio server",,"MCP","MCP stdio server","RAG tool"
"tests.test_mcp_stdio#test_mcp_stdio_route_includes_greedy_token","MCP stdio route tool returns tier decision with Greedy token footer","passed","832ms",,,"Call greedy_token_route via MCP stdio passed (831ms)
  route response: Task: find baseUrl in sample.js | Route: TOOL  (tool-rg-search, 59%) | Complexity: low | Est. tokens: 0 | Rationale: Mechanical search — ripgrep/jq, zero LLM tokens. 0 tokens — ripgrep before RAG/Cursor | Matched: find | Command: cd /tmp... passed (0s)
 Verify TOOL route and Greedy token footer passed (0s)","MCP","MCP stdio server",,"MCP","MCP stdio server","Route tool"
"tests.test_mcp_stdio#test_mcp_stdio_search_finds_match","MCP stdio search tool finds baseUrl in workspace file","passed","817ms",,,"Call greedy_token_search via MCP stdio passed (816ms)
  search response: Search: 'baseUrl' in projects/sample.js | 1:const baseUrl = 'http://localhost'; | --- | Greedy token | This call | Executor: rg — ripgrep on disk | Route: mcp-search | Duration: 5 ms | Spent (MCP executor, LLM tokens): ~0  (ripgrep on di... passed (0s)
 Verify baseUrl match and Greedy token footer passed (0s)","MCP","MCP stdio server",,"MCP","MCP stdio server","Search tool"
"tests.test_mcp_stdio#test_mcp_stdio_lists_five_tools","MCP stdio server advertises five greedy-token tools","passed","615ms",,,"List MCP stdio tools passed (615ms)
  tool names: greedy_token_route | greedy_token_rag | greedy_token_search | greedy_token_usage | greedy_token_pipeline passed (0s)
 Verify five greedy-token tools are advertised passed (0s)","MCP","MCP stdio server",,"MCP","MCP stdio server","Server handshake"
"tests.test_mcp_stdio#test_mcp_stdio_usage_empty_log","MCP stdio usage tool reports empty log gracefully","passed","617ms",,,"Call greedy_token_usage with empty log via MCP stdio passed (616ms)
  usage response: No events since 7d. | --- | Session totals (this window) | Saved vs naive Cursor (all events) | Baseline (naive agent chat):  ~0 | Spent (MCP executor, LLM tokens): ~0  (sum across logged greedy-token calls) | Saved:             ~0  (= b... passed (0s)
  log path: /tmp/pytest-of-runner/pytest-0/test_mcp_stdio_usage_empty_log0/usage.jsonl passed (0s)
 Verify empty log message passed (0s)","MCP","MCP stdio server",,"MCP","MCP stdio server","Usage tool"
"tests.test_mcp_tools#test_mcp_usage_aggregates_log","MCP usage tool aggregates log events and session totals","passed","1ms",,,"Call greedy_token_usage with populated log passed (1ms)
  usage response: == greedy-token usage (since 7d) == | Events: 1 | By tier: | tier        count   est_tokens  saved_vs_cursor | tool            1            0            9,000 | Top routes: | tool-rg-search                  1 | Token counter: tiktoken/cl... passed (0s)
  log path: /tmp/pytest-of-runner/pytest-0/test_mcp_usage_aggregates_log0/usage.jsonl passed (0s)
 Verify aggregated session totals passed (0s)","MCP","MCP tools",,"MCP","MCP tools","Usage tool"
"tests.test_mcp_tools#test_mcp_usage_empty_log","MCP usage tool reports empty log gracefully","passed","1ms",,,"Call greedy_token_usage with empty log passed (1ms)
  usage response: No events since 7d. | --- | Session totals (this window) | Saved vs naive Cursor (all events) | Baseline (naive agent chat):  ~0 | Spent (MCP executor, LLM tokens): ~0  (sum across logged greedy-token calls) | Saved:             ~0  (= b... passed (1ms)
  log path: /tmp/pytest-of-runner/pytest-0/test_mcp_usage_empty_log0/usage.jsonl passed (0s)
 Verify empty log message passed (0s)","MCP","MCP tools",,"MCP","MCP tools","Usage tool"
"tests.test_mcp_handlers#test_mcp_icons_package_fallback","mcp_icons loads SVG from package when static dir missing","passed","1ms",,,,"MCP","MCP tool handlers",,"MCP","MCP tool handlers","Icons"
"tests.test_mcp_handlers#test_mcp_main","mcp.main applies Ollama env and runs server","passed","0s",,,,"MCP","MCP tool handlers",,"MCP","MCP tool handlers","Server main"
"tests.test_pipeline#test_parse_named_pipeline_meta_rag_and_unknown_equals","meta-rag joins multi-word query; unknown key= stays positional","passed","7ms",,,"Parse meta-rag with multi-word query passed (3ms)
 Unknown key=value is part of joined query; path= still binds passed (2ms)","Pipeline","Multi-step chains",,"Pipeline","Multi-step chains","Named recipes"
"tests.test_init#test_metadata_version_reads_installed_distribution","metadata_version reads installed distribution","passed","0s",,,,"Package","Package metadata",,"Package","Package metadata","Version"
"tests.test_security#test_ollama_available_uses_cache","Ollama availability probe caches successful result","passed","3ms",,,"Probe Ollama twice with same URL passed (1ms)
  urlopen call count: 1 passed (0s)
 Verify probe result is cached passed (0s)","Security","Shell quoting",,"Security","Shell quoting","Ollama probe"
"tests.test_wrappers#test_ollama_available_false","Ollama availability returns false when server is down","passed","1ms",,,"Probe unreachable Ollama server passed (0s)
  ollama url: http://localhost:11434 passed (0s)
  available: False passed (0s)
 Verify Ollama is unavailable passed (0s)","Script wrappers","Workspace scripts",,"Script wrappers","Workspace scripts","Ollama probe"
"tests.test_wrappers#test_ollama_available_true","Ollama availability returns true when /api/tags responds","passed","2ms",,,"Probe Ollama /api/tags endpoint passed (1ms)
  ollama url: http://localhost:11434 passed (1ms)
  available: True passed (0s)
 Verify Ollama is available passed (0s)","Script wrappers","Workspace scripts",,"Script wrappers","Workspace scripts","Ollama probe"
"tests.test_wrappers#test_ollama_available_against_stub","Ollama availability returns true when stub /api/tags responds","passed","2ms",,,"Probe Ollama stub server passed (2ms)
  ollama stub url: http://127.0.0.1:42919 passed (0s)
  available: True passed (0s)
 Verify stub responds as available passed (0s)","Script wrappers","Workspace scripts",,"Script wrappers","Workspace scripts","Ollama probe"
"tests.test_router#test_ollama_est_tokens_nonzero","Ollama available route reports non-zero est_tokens","passed","1ms",,,"Estimate tokens for available ollama route passed (0s)
  estimate: { | ""complexity"": ""medium"", | ""est_tokens"": 6, | ""rationale"": ""Cheap LLM — bulk work off expensive path; local/cheap spend."" | } passed (0s)
 Verify est_tokens is positive cheap-LLM spend passed (0s)","Routing","Task router",,"Routing","Task router","Token estimate"
"tests.test_settings#test_defaults_without_config","Ollama settings return defaults when no config files","passed","1ms",,,"Load Ollama settings without config files passed (0s)
  settings: { | ""url"": ""http://localhost:11434"", | ""model"": ""qwen2.5-coder:7b-instruct-q4_K_M"", | ""source"": ""default"" | } passed (0s)
 Verify default Ollama settings passed (0s)","Configuration","Ollama settings",,"Configuration","Ollama settings","Defaults"
"tests.test_settings#test_env_overrides_files","OLLAMA_* env vars override config files","passed","1ms",,,"Resolve Ollama settings with env overrides passed (0s)
  settings: { | ""url"": ""http://env:11434"", | ""model"": ""env-model"", | ""source"": ""env"" | } passed (0s)
 Verify env vars take precedence passed (0s)","Configuration","Ollama settings",,"Configuration","Ollama settings","Precedence"
"tests.test_wrappers#test_ollama_status_line_unavailable","ollama_status_line reports unavailable when server is down","passed","1ms",,,,"Script wrappers","Workspace scripts",,"Script wrappers","Workspace scripts","Status"
"tests.test_cheap_llm#test_openai_compat_base","openai_compat_base appends /v1 when missing","passed","0s",,,,"Configuration","Cheap LLM adapters",,"Configuration","Cheap LLM adapters","URL normalization"
"tests.test_init#test_package_version","Package exposes version string","passed","1ms",,,"version: 0.5.8 passed (0s)","Package","Package metadata",,"Package","Package metadata","Version"
"tests.test_tool_output#test_version_matches_pyproject","Package version matches pyproject.toml","passed","1ms",,,"Read version from pyproject.toml passed (1ms)
  pyproject version: 0.5.8 passed (0s)
  package __version__: 0.5.8 passed (0s)
 Verify versions match passed (0s)","Tool output","Output filtering",,"Tool output","Output filtering","Package version"
"tests.test_pipeline#test_parse_custom_chain","Parse custom then-chain pipeline syntax","passed","3ms",,,"Parse custom then-chain pipeline passed (3ms)
  parsed steps: [ | { | ""step_id"": ""check-meta-sync"", | ""tier"": ""python"", | ""args"": """" | }, | { | ""step_id"": ""rag"", | ""tier"": ""rag"", | ""args"": ""baseUrl -D flag"" | } | ] passed (0s)
 Verify check-meta-sync and rag steps passed (0s)","Pipeline","Multi-step chains",,"Pipeline","Multi-step chains","Custom chain"
"tests.test_pipeline#test_parse_named_pipeline_meta_audit","Parse meta-audit named pipeline recipe","passed","5ms",,,"Parse meta-audit pipeline recipe passed (4ms)
  parsed steps: [ | { | ""step_id"": ""check-meta-sync"", | ""tier"": ""python"", | ""args"": """" | }, | { | ""step_id"": ""audit-skill"", | ""tier"": ""ollama"", | ""args"": "".cursor/skills/configurator-boolean/SKILL.md"" | } | ] passed (0s)
 Verify two-step meta-audit chain passed (0s)","Pipeline","Multi-step chains",,"Pipeline","Multi-step chains","Named recipes"
"tests.test_pipeline#test_parse_named_pipeline_search_rag_multiword_query","Parse search-rag multi-word query with path= keyword","passed","3ms",,,"Parse search-rag with multi-word query and path= passed (3ms)
  parsed steps: [ | { | ""step_id"": ""search"", | ""tier"": ""tool"", | ""args"": ""hello world\tconfigurator-option-presets.html"" | }, | { | ""step_id"": ""rag"", | ""tier"": ""rag"", | ""args"": ""hello world"" | } | ] passed (0s)
 Verify query words join; path stays separate passed (0s)","Pipeline","Multi-step chains",,"Pipeline","Multi-step chains","Named recipes"
"tests.test_pipeline#test_parse_named_pipeline_search_rag_multiword_positional_path","Parse search-rag multi-word query with trailing path positional","passed","3ms",,,"Parse search-rag with multi-word query + path token passed (3ms)
 Verify last token is path; earlier tokens join as query passed (0s)","Pipeline","Multi-step chains",,"Pipeline","Multi-step chains","Named recipes"
"tests.test_pipeline#test_parse_named_pipeline_search_rag_reuses_query","Parse search-rag recipe and reuse query for RAG step","passed","3ms",,,"Parse search-rag pipeline recipe passed (3ms)
  parsed steps: [ | { | ""step_id"": ""search"", | ""tier"": ""tool"", | ""args"": ""baseUrl\tTestConfig"" | }, | { | ""step_id"": ""rag"", | ""tier"": ""rag"", | ""args"": ""baseUrl"" | } | ] passed (0s)
 Verify search query is reused for RAG step passed (0s)","Pipeline","Multi-step chains",,"Pipeline","Multi-step chains","Named recipes"
"tests.test_pipeline#test_parse_named_pipeline_search_rag_path_kwarg","Parse search-rag with path= keyword (agent / rule style)","passed","3ms",,,"Parse search-rag with path= keyword passed (3ms)
  parsed steps: [ | { | ""step_id"": ""search"", | ""tier"": ""tool"", | ""args"": ""baseUrl\tconfigurator-option-presets.html"" | }, | { | ""step_id"": ""rag"", | ""tier"": ""rag"", | ""args"": ""baseUrl"" | } | ] passed (0s)
 Verify path= is not treated as a literal path prefix passed (0s)","Pipeline","Multi-step chains",,"Pipeline","Multi-step chains","Named recipes"
"tests.test_usage#test_parse_since_invalid","parse_since rejects invalid values","passed","2ms",,,,"Greedy token","Usage telemetry",,"Greedy token","Usage telemetry","Time filter"
"tests.test_tokens#test_collect_paths_skips_git","Path collector skips .git directories","passed","2ms",,,"Collect paths in workspace with .git passed (0s)
  collected paths: /tmp/pytest-of-runner/pytest-0/test_collect_paths_skips_git0/.cursor/rules/test.mdc | /tmp/pytest-of-runner/pytest-0/test_collect_paths_skips_git0/.cursor/skills/configurator-boolean/SKILL.md | /tmp/pytest-of-runner/pytest-0/test_collect... passed (0s)
 Verify .git paths are excluded passed (0s)","Greedy token","Token counting",,"Greedy token","Token counting","Path collection"
"tests.test_pipeline#test_pipeline_continue_on_error","Pipeline continue-on-error keeps running after failure","passed","9ms",,,,"Pipeline","Multi-step chains",,"Pipeline","Multi-step chains","Continue on error"
"tests.test_pipeline#test_pipeline_dry_run","Pipeline dry-run does not execute allowlisted steps","passed","4ms",,,"Dry-run check-meta-sync then rag pipeline passed (4ms)
  planned steps: [ | { | ""step_id"": ""check-meta-sync"", | ""tier"": ""python"", | ""executed"": false | }, | { | ""step_id"": ""rag"", | ""tier"": ""rag"", | ""executed"": false | } | ] passed (0s)
 Verify steps are planned but not executed passed (0s)","Pipeline","Multi-step chains",,"Pipeline","Multi-step chains","Dry run"
"tests.test_pipeline#test_pipeline_execute_check_meta_sync","Pipeline execute runs check-meta-sync wrapper script","passed","9ms",,,"Execute check-meta-sync pipeline passed (8ms)
  step output: check-meta-sync-ok passed (0s)
 Verify wrapper script succeeded passed (0s)","Pipeline","Multi-step chains",,"Pipeline","Multi-step chains","Execute"
"tests.test_pipeline#test_pipeline_execute_meta_audit_with_ollama_stub","Pipeline execute runs meta-audit Ollama step against HTTP stub","passed","98ms",,,"Execute meta-audit pipeline against Ollama stub passed (98ms)
  step results: [ | { | ""step_id"": ""check-meta-sync"", | ""ok"": true, | ""executed"": true | }, | { | ""step_id"": ""audit-skill"", | ""ok"": true, | ""executed"": true | } | ] passed (0s)
  check-meta-sync output: check-meta-sync-ok passed (0s)
  audit-skill output: {""ok"":true,""issues"":[],""suggested_trim_lines"":0,""keep_sections"":[""intro""]} passed (0s)
 Verify both steps completed without early stop passed (0s)","Pipeline","Multi-step chains",,"Pipeline","Multi-step chains","Execute"
"tests.test_pipeline#test_pipeline_execute_search_and_rag","Pipeline execute runs search and RAG allowlisted steps","passed","16ms",,,"Execute search then RAG pipeline passed (16ms)
  step results: [ | { | ""step_id"": ""search"", | ""ok"": true, | ""executed"": true | }, | { | ""step_id"": ""rag"", | ""ok"": true, | ""executed"": true | } | ] passed (0s)
  search output: Search: 'baseUrl' in projects/sample.js | 1:const baseUrl = 'http://localhost'; passed (0s)
  rag output: RAG hits for: baseUrl -D flag | 1. [test-baseurl] score=4.0  (config) | docs/rag/config/test-chunk.md | baseUrl is configured via -DbaseUrl flag in Gradle. | --- passed (0s)
 Verify both steps executed successfully passed (0s)","Pipeline","Multi-step chains",,"Pipeline","Multi-step chains","Execute"
"tests.test_pipeline#test_pipeline_execute_skips_unavailable_ollama","Pipeline execute skips Ollama step when server is unavailable","passed","10ms",,,"Execute meta-audit with Ollama unavailable passed (9ms)
  ollama step output: Cheap LLM unavailable (ollama, http://localhost:11434). Start the runtime or use the expensive LLM path (Cursor). passed (0s)
  stopped early: True passed (0s)
 Verify pipeline stops after Ollama failure passed (0s)","Pipeline","Multi-step chains",,"Pipeline","Multi-step chains","Execute"
"tests.test_pipeline#test_format_pipeline_footer_has_by_executor","Pipeline footer includes per-executor savings table","passed","10ms",,,"Format pipeline footer from dry-run result passed (10ms)
  pipeline footer: --- | Greedy token — pipeline | Per-step savings (if each step were a separate naive Cursor chat): | #  step                   executor     ms   spent  baseline     saved  billing | 1  check-meta-sync        python        0       0     6... passed (0s)
 Verify per-executor sections; dry-run does not inflate saved passed (0s)","Pipeline","Multi-step chains",,"Pipeline","Multi-step chains","Token footer"
"tests.test_pipeline#test_pipeline_search_step_billing_uses_rg","Pipeline search step billing uses executor_sub=rg (not tool→script)","passed","19ms",,,"Execute search-rag and format footer passed (19ms)
  pipeline footer: --- | Greedy token — pipeline | Per-step savings (if each step were a separate naive Cursor chat): | #  step                   executor     ms   spent  baseline     saved  billing | 1  search                 rg            5       0     6... passed (0s)
 Verify search row shows rg + ripgrep billing passed (0s)","Pipeline","Multi-step chains",,"Pipeline","Multi-step chains","Token footer"
"tests.test_pipeline#test_pipeline_search_step_billing_uses_python_fallback","Pipeline search step billing uses python when rg unavailable","passed","18ms",,,"Disable ripgrep and execute search-rag passed (15ms)
  pipeline footer: --- | Greedy token — pipeline | Per-step savings (if each step were a separate naive Cursor chat): | #  step                   executor     ms   spent  baseline     saved  billing | 1  search                 python        2       0     6... passed (0s)
 Verify search row shows python + script billing passed (3ms)","Pipeline","Multi-step chains",,"Pipeline","Multi-step chains","Token footer"
"tests.test_pipeline#test_pipeline_skips_non_allowlisted","Pipeline skips non-allowlisted step on execute","passed","3ms",,,,"Pipeline","Multi-step chains",,"Pipeline","Multi-step chains","Execute"
"tests.test_pipeline#test_pipeline_step_timeout","Pipeline step timeout returns exit 124","passed","6ms",,,,"Pipeline","Multi-step chains",,"Pipeline","Multi-step chains","Execute"
"tests.test_pipeline#test_pipeline_stops_on_error","Pipeline stops early when a step fails","passed","11ms",,,"Execute pipeline with mocked failing step passed (10ms)
  step results: [ | { | ""ok"": true, | ""executed"": true | }, | { | ""ok"": false, | ""executed"": true | } | ] passed (0s)
 Verify pipeline stops early on failure passed (0s)","Pipeline","Multi-step chains",,"Pipeline","Multi-step chains","Error handling"
"tests.test_coverage_gaps#test_pipeline_public_edges","pipeline: empty, wrapper args, dry search, stop-early footer","passed","41ms",,,,"Test infrastructure","Coverage gaps",,"Test infrastructure","Coverage gaps",
"tests.test_pipeline#test_pipeline_all_ok_empty","PipelineResult.all_ok is false for empty steps","passed","0s",,,,"Pipeline","Multi-step chains",,"Pipeline","Multi-step chains","Pipeline result"
"tests.test_coverage_gaps#test_executors_public_branches","plan_run / execute_task public branches (weak rg, python, inventory)","passed","6ms",,,,"Test infrastructure","Coverage gaps",,"Test infrastructure","Coverage gaps",
"tests.test_executors#test_plan_run_python","plan_run builds python tier command with wrapper read_only","passed","0s",,,,"Routing","Task execution",,"Routing","Task execution","Plan run"
