Full Name,Name,Status,Duration,Error,Stack Trace,Steps,Parent Suite,Suite,Sub Suite,Epic,Feature,Story
"tests.test_executors#test_plan_run_audit_skill_executable","plan_run marks stdout-only audit-skill as executable","passed","1ms",,,,"Routing","Task execution",,"Routing","Task execution","Execute safety"
"tests.test_executors#test_plan_run_cursor","plan_run returns cursor guidance","passed","1ms",,,,"Routing","Task execution",,"Routing","Task execution","Plan run"
"tests.test_executors#test_plan_run_unknown","plan_run returns fallback for unknown target","passed","0s",,,,"Routing","Task execution",,"Routing","Task execution","Plan run"
"tests.test_executors#test_plan_run_rag","plan_run returns RAG dry-run output","passed","1ms",,,,"Routing","Task execution",,"Routing","Task execution","Plan run"
"tests.test_prompt_compress#test_compress_prompt_detail_heuristic","Prompt detail compression uses heuristic when Ollama disabled","passed","1ms",,,"Compress prompt detail without Ollama passed (0s)
  compressed prompt: Do X. | Why: because. passed (0s)
  eval_tokens: None passed (0s)
 Verify heuristic compression result passed (0s)","Prompt compression","Heuristic compress",,"Prompt compression","Heuristic compress","Detail mode"
"tests.test_coverage_gaps#test_prompt_compress_edges","prompt_compress heuristic edges","passed","3ms",,,,"Test infrastructure","Coverage gaps",,"Test infrastructure","Coverage gaps",
"tests.test_rag_search#test_format_hits_includes_excerpt","RAG hit formatter includes chunk id and excerpt","passed","1ms",,,"Search and format RAG hits passed (1ms)
  formatted output: RAG hits for: baseUrl | 1. [test-baseurl] score=3.0  (config) | docs/rag/config/test-chunk.md | baseUrl is configured via -DbaseUrl flag in Gradle. | --- passed (0s)
 Verify chunk id and excerpt in output passed (0s)","RAG","RAG search",,"RAG","RAG search","Formatting"
"tests.test_rag_search#test_format_hits_empty","RAG hit formatter reports no hits with manifest hint","passed","1ms",,,"Format empty RAG hits passed (1ms)
  formatted output: No RAG hits for: missing | Index: docs/rag/manifest.jsonl passed (0s)
 Verify no-hits message with manifest hint passed (0s)","RAG","RAG search",,"RAG","RAG search","Formatting"
"tests.test_rag_index#test_get_indexed_chunks_caches","RAG index caches manifest entries","passed","2ms",,,"Load indexed chunks twice passed (1ms)
  first chunk: { | ""id"": ""test-baseurl"", | ""count"": 1 | } passed (0s)
  cache hit: True passed (0s)
 Verify cache returns same object passed (0s)","RAG","RAG index",,"RAG","RAG index","Cache"
"tests.test_rag_index#test_rag_index_missing_manifest","RAG index handles missing manifest","passed","1ms",,,,"RAG","RAG index",,"RAG","RAG index","Index"
"tests.test_rag_search#test_search_rag_finds_baseurl","RAG search finds baseUrl chunk in config domain","passed","1ms",,,"Search RAG for baseUrl in config domain passed (1ms)
  hits: [ | { | ""domain"": ""config"", | ""excerpt"": ""baseUrl is configured via -DbaseUrl flag in Gradle."" | } | ] passed (0s)
 Verify baseUrl chunk is found passed (0s)","RAG","RAG search",,"RAG","RAG search","Manifest search"
"tests.test_rag_index#test_search_reads_only_top_hits","RAG search reads only top-ranked chunk files","passed","2ms",,,"Search RAG with file read tracking passed (1ms)
  read paths: /tmp/pytest-of-runner/pytest-0/test_search_reads_only_top_hit0/docs/rag/config/chunk-0.md passed (0s)
  hit count: 1 passed (0s)
 Verify only top hit file was read passed (0s)","RAG","RAG index",,"RAG","RAG index","Greedy token"
"tests.test_rag_search#test_search_rag_empty_query","RAG search returns empty list for blank query","passed","1ms",,,"Search RAG with blank query passed (0s)
  hit count: 0 passed (0s)
 Verify empty result list passed (0s)","RAG","RAG search",,"RAG","RAG search","Input validation"
"tests.test_rag_search#test_search_rag_no_manifest","RAG search returns empty when manifest is absent","passed","1ms",,,"Search RAG in workspace without manifest passed (1ms)
  hit count: 0 passed (0s)
 Verify empty result list passed (0s)","RAG","RAG search",,"RAG","RAG search","Missing manifest"
"tests.test_rag_index#test_search_rag_still_finds_baseurl","RAG search still finds baseUrl after index rebuild","passed","1ms",,,"Rebuild index and search for baseUrl passed (1ms)
  hits: [ | { | ""chunk_id"": ""test-baseurl"", | ""has_body"": true | } | ] passed (0s)
 Verify baseUrl chunk is found with body passed (0s)","RAG","RAG index",,"RAG","RAG index","Search"
"tests.test_budget#test_format_tool_footer_rag_tier_alternatives_match_spent","RAG Tier alternatives ← this call uses actual Spent, not router estimate","passed","27ms",,,"rag footer: --- | Greedy token | This call | Executor: rag — docs/rag chunk read | Route: mcp-rag | Spent (MCP executor, LLM tokens): ~9,091  (docs/rag chunks read into context) | Billing: read docs/rag, 5 chunk(s) — small context vs expensive LLM c... passed (0s)","Greedy token","Token budget",,"Greedy token","Token budget","Tool footer"
"tests.test_rag_tokens#test_rag_est_tokens_reuses_body_without_reread","RAG token estimate reuses hit body without re-reading files","passed","1ms",,,"Estimate RAG tokens from hit body passed (0s)
  hit body: baseUrl is configured via -DbaseUrl flag in Gradle. passed (0s)
  estimated tokens: 12 passed (0s)
 Verify no file re-read and positive token count passed (0s)","Greedy token","RAG token estimate",,"Greedy token","RAG token estimate","Token estimate"
"tests.test_budget#test_rag_est_tokens","rag_est_tokens counts body and file paths","passed","1ms",,,,"Greedy token","Token budget",,"Greedy token","Token budget","RAG tokens"
"tests.test_coverage_gaps#test_rag_est_tokens_reads_file","rag_est_tokens reads chunk file when body is absent","passed","0s",,,,"Test infrastructure","Coverage gaps",,"Test infrastructure","Coverage gaps",
"tests.test_init#test_release_version_gate","Release gate: pyproject and package version match CLI target","skipped","0s","Skipped: pass --release-version or set GREEDY_TOKEN_RELEASE_VERSION","('/home/runner/work/greedy-token/greedy-token/tests/test_init.py', 84, 'Skipped: pass --release-version or set GREEDY_TOKEN_RELEASE_VERSION')",,"Package","Package metadata",,"Package","Package metadata","Version"
"tests.test_coverage_gaps#test_remaining_public_branches","Remaining public branches: rag excerpt, jq, pipeline, tool_paths, python tree","passed","127ms",,,,"Test infrastructure","Coverage gaps",,"Test infrastructure","Coverage gaps",
"tests.test_coverage_gaps#test_remaining_public_coverage_edges","Remaining public edges for fail_under=100","passed","413ms",,,,"Test infrastructure","Coverage gaps",,"Test infrastructure","Coverage gaps",
"tests.test_code_search#test_resolve_search_path_prefers_default_among_multi","resolve prefers unique DEFAULT_PATHS among multiple non-vendor hits","passed","9ms",,,"Plant same dirname under projects and outside DEFAULT_PATHS passed (1ms)
 Resolve bare name passed (7ms)
   resolved: /tmp/pytest-of-runner/pytest-0/test_resolve_search_path_prefe1/projects/pref-utils passed (0s)
  Verify DEFAULT_PATHS preference and helpers passed (0s)","Code search","Search path resolution",,"Code search","Search path resolution","Path resolution"
"tests.test_code_search#test_resolve_search_path_prefers_default_paths","resolve prefers unique DEFAULT_PATHS hit over vendor","passed","4ms",,,"Plant same dirname in projects and node_modules passed (1ms)
 Resolve bare name utils passed (3ms)
   resolved path: /tmp/pytest-of-runner/pytest-0/test_resolve_search_path_prefe0/projects/lib/utils passed (0s)
  Verify projects hit wins passed (0s)","Code search","Search path resolution",,"Code search","Search path resolution","Path resolution"
"tests.test_code_search#test_resolve_search_path_ambiguous_dirs","resolve reports ambiguous when multiple DEFAULT_PATHS dirs match","passed","5ms",,,"Plant same dirname under projects and docs passed (1ms)
 Resolve ambiguous bare name passed (4ms)
   reason: ambiguous passed (0s)
  Verify ambiguous passed (0s)","Code search","Search path resolution",,"Code search","Search path resolution","Path resolution"
"tests.test_code_search#test_resolve_search_path_in_minimal_workspace","Resolve search path by filename in minimal workspace","passed","3ms",,,"Resolve sample.js in minimal workspace passed (3ms)
  resolved path: /tmp/pytest-of-runner/pytest-0/test_resolve_search_path_in_mi0/projects/sample.js passed (0s)
 Verify filename match passed (0s)","Code search","Search path resolution",,"Code search","Search path resolution","Minimal workspace"
"tests.test_code_search#test_resolve_search_path_by_filename","Resolve search path by filename in workspace","skipped","0s","Skipped: workspace root not found (parent workspace checkout required)","('/home/runner/work/greedy-token/greedy-token/tests/test_code_search.py', 19, 'Skipped: workspace root not found (parent workspace checkout required)')",,"Code search","Search path resolution",,"Code search","Search path resolution","Workspace"
"tests.test_code_search#test_resolve_search_path_skips_node_modules","resolve skips node_modules bare-name trap","passed","4ms",,,"Plant unique bare name only under node_modules passed (1ms)
 Resolve bare name search passed (3ms)
   reason: not_found passed (0s)
   path: (none) passed (0s)
  Verify vendor-only match is not_found passed (0s)","Code search","Search path resolution",,"Code search","Search path resolution","Path resolution"
"tests.test_tool_paths#test_resolve_rg_override","resolve_rg honors GREEDY_TOKEN_RG override","passed","1ms",,,"Resolve rg from override passed (1ms)
  resolved: /tmp/pytest-of-runner/pytest-0/test_resolve_rg_override0/custom-rg passed (1ms)","Tool paths","Ripgrep resolution",,"Tool paths","Ripgrep resolution","Ripgrep"
"tests.test_tool_paths#test_resolve_rg_skips_invalid","resolve_rg skips duplicate and invalid candidates","passed","1ms",,,,"Tool paths","Ripgrep resolution",,"Tool paths","Ripgrep resolution","Ripgrep"
"tests.test_code_search#test_resolve_search_path_unique_glob","resolve_search_path picks unique glob match","passed","2ms",,,"Resolve filename via unique glob passed (2ms)
  resolved path: /tmp/pytest-of-runner/pytest-0/test_resolve_search_path_uniqu0/projects/sample.js passed (0s)
 Verify unique glob match passed (0s)","Code search","Search path resolution",,"Code search","Search path resolution","Path resolution"
"tests.test_code_search#test_resolve_search_path_rejects_outside_root","resolve_search_path rejects absolute path outside workspace","passed","1ms",,,"Resolve absolute path outside workspace passed (1ms)
  outside path: /tmp/pytest-of-runner/pytest-0/outside-root0/secret.txt passed (0s)
  resolved: (none) passed (0s)
 Verify outside-root path is rejected passed (0s)","Code search","Search path resolution",,"Code search","Search path resolution","Path resolution"
"tests.test_code_search#test_resolve_search_path_absolute_file","resolve_search_path resolves absolute file path","passed","1ms",,,"Resolve absolute file path passed (0s)
  resolved path: /tmp/pytest-of-runner/pytest-0/test_resolve_search_path_absol0/projects/sample.js passed (0s)
 Verify absolute path match passed (0s)","Code search","Search path resolution",,"Code search","Search path resolution","Path resolution"
"tests.test_code_search#test_resolve_search_path_directory","resolve_search_path resolves directory under root","passed","1ms",,,"Resolve docs directory passed (1ms)
  resolved path: /tmp/pytest-of-runner/pytest-0/test_resolve_search_path_direc0/docs passed (1ms)
 Verify directory match passed (0s)","Code search","Search path resolution",,"Code search","Search path resolution","Path resolution"
"tests.test_code_search#test_resolve_search_path_relative","resolve_search_path resolves relative path under root","passed","1ms",,,"Resolve relative path under workspace root passed (1ms)
  resolved path: /tmp/pytest-of-runner/pytest-0/test_resolve_search_path_relat0/projects/sample.js passed (0s)
 Verify relative path resolves to sample.js passed (0s)","Code search","Search path resolution",,"Code search","Search path resolution","Path resolution"
"tests.test_code_search#test_resolve_search_path_empty","resolve_search_path returns None for empty hint","passed","0s",,,"Resolve empty path hint passed (0s)
  resolved path: (none) passed (0s)
 Verify None for empty hint passed (0s)","Code search","Search path resolution",,"Code search","Search path resolution","Path resolution"
"tests.test_code_search#test_resolve_search_path_ambiguous_glob","resolve_search_path returns None when multiple glob matches","passed","4ms",,,"Add duplicate sample.js for ambiguous glob passed (0s)
 Resolve filename with multiple matches passed (4ms)
   resolved path: (none) passed (0s)
  Verify ambiguous glob returns None passed (0s)","Code search","Search path resolution",,"Code search","Search path resolution","Path resolution"
"tests.test_init#test_resolve_version_release_env_fallback","resolve_version honors GREEDY_TOKEN_RELEASE_VERSION without pyproject or metadata","passed","0s",,,,"Package","Package metadata",,"Package","Package metadata","Version"
"tests.test_init#test_resolve_version_raises_when_unresolvable","resolve_version raises when version cannot be resolved","passed","2ms",,,,"Package","Package metadata",,"Package","Package metadata","Version"
"tests.test_init#test_resolve_version_uses_metadata_outside_source_tree","resolve_version uses metadata outside source checkout","passed","1ms",,,,"Package","Package metadata",,"Package","Package metadata","Version"
"tests.test_init#test_resolve_version_uses_pyproject_in_source_tree","resolve_version uses pyproject.toml in source checkout","passed","1ms",,,"pyproject version: 0.5.8 passed (0s)","Package","Package metadata",,"Package","Package metadata","Version"
"tests.test_wrappers#test_resolve_wrapper_command_python_script","resolve_wrapper_command builds python invocation for .py scripts","passed","0s",,,,"Script wrappers","Workspace scripts",,"Script wrappers","Workspace scripts","Command resolution"
"tests.test_tool_paths#test_rg_timeout_constant","RG timeout is configured","passed","0s",,,,"Tool paths","Ripgrep resolution",,"Tool paths","Ripgrep resolution","Constants"
"tests.test_tool_paths#test_rg_path_for_shell_fallback","rg_path_for_shell falls back to rg when not found","passed","0s",,,,"Tool paths","Ripgrep resolution",,"Tool paths","Ripgrep resolution","Ripgrep"
"tests.test_tool_paths#test_root_cd_prefix","root_cd_prefix emits cd command for workspace","passed","0s",,,"prefix: cd /tmp/pytest-of-runner/pytest-0/test_root_cd_prefix0 && passed (0s)","Tool paths","Ripgrep resolution",,"Tool paths","Ripgrep resolution","Root prefix"
"tests.test_usage#test_rotate_log_noop","rotate_log_if_needed returns false when file missing or small","passed","0s",,,,"Greedy token","Usage telemetry",,"Greedy token","Usage telemetry","Rotation"
"tests.test_router#test_route_rag_question","Route documentation question to RAG tier","passed","23ms",,,"Route documentation question passed (23ms)
  decision: { | ""target"": ""rag"", | ""route_id"": ""rag-config-keys"" | } passed (0s)
 Verify RAG tier selection passed (0s)","Routing","Task router",,"Routing","Task router","RAG tier"
"tests.test_usage#test_build_route_event_truncates_task","Route event builder truncates long task strings","passed","4ms",,,"Build route event from long task passed (3ms)
  route event: { | ""task_length"": 500, | ""task_suffix"": ""xxxx…"" | } passed (0s)
 Verify task truncation and schema fields passed (0s)","Greedy token","Usage telemetry",,"Greedy token","Usage telemetry","Route events"
"tests.test_router#test_route_find_goes_to_tool","Route find task to tool tier with read-only plan","passed","23ms",,,"Route find task passed (23ms)
  decision: { | ""target"": ""tool"", | ""read_only"": true, | ""route_id"": ""tool-rg-search"" | } passed (0s)
  command: cd /tmp/pytest-of-runner/pytest-0/test_route_find_goes_to_tool0 && /usr/bin/rg -n --max-columns 200 -F baseUrl -g '!.git/**' -g '!node_modules/**' -g '!build/**' -g '!.venv/**' -g '!.cursor/hooks/**' --max-count 50 projects docs stacks s... passed (0s)
 Verify tool tier with read-only plan passed (0s)","Routing","Task router",,"Routing","Task router","Tool tier"
"tests.test_router#test_route_cursor_fallback","Route open-ended task to cursor fallback","passed","24ms",,,"Route open-ended explain task passed (23ms)
  decision: { | ""target"": ""cursor"", | ""route_id"": ""cursor-fallback"" | } passed (0s)
 Verify cursor fallback route passed (0s)","Routing","Task router",,"Routing","Task router","Cursor tier"
"tests.test_router#test_route_skips_unavailable_ollama","Route skips Ollama tier when server is unavailable","passed","24ms",,,"Route audit task with Ollama unavailable passed (24ms)
  decision: { | ""target"": ""cursor"", | ""route_id"": ""cursor-fallback"" | } passed (0s)
 Verify Ollama tier is skipped passed (0s)","Routing","Task router",,"Routing","Task router","Ollama availability"
"tests.test_coverage_gaps#test_router_public_edges","router public: SEARCH prefixes, tooling, format_decision","passed","111ms",,,,"Test infrastructure","Coverage gaps",,"Test infrastructure","Coverage gaps",
"tests.test_pipeline#test_run_pipeline_default_is_dry_run","run_pipeline defaults to dry-run (execute=False)","passed","4ms",,,"Call run_pipeline without execute kwarg passed (3ms)
  step results: [ | { | ""executed"": false, | ""ok"": true | } | ] passed (0s)
 Verify default is dry-run passed (1ms)","Pipeline","Multi-step chains",,"Pipeline","Multi-step chains","Dry run"
"tests.test_code_search#test_search_code_scoped_file_no_match","Scoped file search reports no matches when absent","skipped","0s","Skipped: workspace root not found (parent workspace checkout required)","('/home/runner/work/greedy-token/greedy-token/tests/test_code_search.py', 41, 'Skipped: workspace root not found (parent workspace checkout required)')",,"Code search","Search path resolution",,"Code search","Search path resolution","Scoped search"
"tests.test_code_search#test_search_code_finds_in_minimal_workspace","Scoped search finds baseUrl in sample.js","passed","7ms",,,"Search baseUrl in sample.js passed (7ms)
  search output: Search: 'baseUrl' in projects/sample.js | 1:const baseUrl = 'http://localhost'; passed (0s)
  engine: rg passed (0s)
 Verify baseUrl match passed (0s)","Code search","Search path resolution",,"Code search","Search path resolution","Scoped search"
"tests.test_wrappers#test_wrappers_registry_has_check_meta_sync","Script wrappers registry includes read-only check-meta-sync","passed","1ms",,,"Inspect wrappers registry passed (0s)
  check-meta-sync entry: { | ""present"": true, | ""read_only"": true | } passed (0s)
 Verify check-meta-sync is read-only passed (0s)","Script wrappers","Workspace scripts",,"Script wrappers","Workspace scripts","Registry"
"tests.test_code_search#test_search_code_python_global","search_code python global workspace scan","passed","3ms",,,"Disable ripgrep resolver passed (0s)
 Search baseUrl globally via python scan passed (2ms)
   output: Search: 'baseUrl' in workspace [python] | (rg not in PATH — python tree scan) | projects/sample.js:1:const baseUrl = 'http://localhost'; | docs/rag/config/test-chunk.md:1:baseUrl is configured via -DbaseUrl flag in Gradle. passed (0s)
   engine: python passed (0s)
  Verify match or no-matches response passed (0s)","Code search","Search path resolution",,"Code search","Search path resolution","Python fallback"
"tests.test_code_search#test_search_code_python_tree_with_path","search_code python tree scan with path glob","passed","4ms",,,"Disable ripgrep resolver passed (1ms)
 Search baseUrl with path glob via python tree passed (3ms)
   output: Search: 'baseUrl' in projects/sample.js [python] | (rg not in PATH — python file scan) | /tmp/pytest-of-runner/pytest-0/test_search_code_python_tree_w0/projects/sample.js:1:const baseUrl = 'http://localhost'; passed (0s)
   engine: python passed (0s)
  Verify python engine and match passed (0s)","Code search","Search path resolution",,"Code search","Search path resolution","Python fallback"
"tests.test_code_search#test_search_code_rejects_outside_root","search_code refuses absolute path outside workspace","passed","2ms",,,"Search with absolute path outside workspace passed (1ms)
  search output: Error: path '/tmp/pytest-of-runner/pytest-0/outside-search0/secret.txt' is outside workspace root (/tmp/pytest-of-runner/pytest-0/test_search_code_rejects_outsi0). Search is confined to the workspace. passed (0s)
 Verify error and no secret leak passed (0s)","Code search","Search path resolution",,"Code search","Search path resolution","Path resolution"
"tests.test_code_search#test_search_code_empty_query","search_code rejects empty query","passed","0s",,,"Search with blank query passed (0s)
  search output: Error: query is required. passed (0s)
 Verify validation error passed (0s)","Code search","Search path resolution",,"Code search","Search path resolution","Validation"
"tests.test_code_search#test_search_code_ambiguous_path_error","search_code reports ambiguous path instead of silent glob","passed","5ms",,,"Add duplicate sample.js passed (0s)
 Search with ambiguous path passed (4ms)
   search output: Error: path 'sample.js' is ambiguous under test_search_code_ambiguous_pat0. Pass a path relative to the workspace root. | Candidates: | - projects/sample.js | - projects/nested/sample.js passed (0s)
  Verify ambiguous error lists candidates passed (0s)","Code search","Search path resolution",,"Code search","Search path resolution","Path resolution"
"tests.test_code_search#test_search_code_python_no_match","search_code reports no matches in scoped file","passed","3ms",,,"Disable ripgrep resolver passed (0s)
 Search missing token in scoped file passed (2ms)
   output: No matches for 'ZZZNOTFOUND' in projects/sample.js. | Try greedy_token_rag for docs/rag lookup, or search without path. passed (0s)
  Verify no matches message passed (0s)","Code search","Search path resolution",,"Code search","Search path resolution","Python fallback"
"tests.test_code_search#test_search_code_path_not_found","search_code reports not found for unknown path","passed","3ms",,,"Search with missing path hint passed (3ms)
  search output: Error: path 'no-such-file-xyz.js' not found under workspace root (/tmp/pytest-of-runner/pytest-0/test_search_code_path_not_foun0). Use a relative path (e.g. projects/…/file.py) or a unique filename. passed (0s)
 Verify not-found error passed (0s)","Code search","Search path resolution",,"Code search","Search path resolution","Path resolution"
"tests.test_code_search#test_search_code_directory_scope","search_code scopes to directory path without mocking rg","passed","7ms",,,"Search inside docs directory passed (5ms)
  search output: Search: 'dirNeedleXYZ' in docs | docs/note.md:1:dirNeedleXYZ passed (0s)
  engine: rg passed (0s)
 Verify directory-scoped hit passed (0s)","Code search","Search path resolution",,"Code search","Search path resolution","Scoped search"
"tests.test_code_search#test_search_code_python_fallback","search_code uses python scan when rg unavailable","passed","3ms",,,"Disable ripgrep resolver passed (0s)
 Search baseUrl in sample.js via python fallback passed (2ms)
   output: Search: 'baseUrl' in projects/sample.js [python] | (rg not in PATH — python file scan) | /tmp/pytest-of-runner/pytest-0/test_search_code_python_fallba0/projects/sample.js:1:const baseUrl = 'http://localhost'; passed (0s)
   engine: python passed (0s)
  Verify python engine and match passed (0s)","Code search","Search path resolution",,"Code search","Search path resolution","Python fallback"
"tests.test_rag_index#test_search_rag_empty_query","search_rag returns empty for token-less query","passed","0s",,,,"RAG","RAG index",,"RAG","RAG index","Search"
"tests.test_pipeline#test_parse_named_pipeline_search_rag_path_kwarg_and_missing","search-rag path= kwarg + multi-word query; missing args raise","passed","9ms",,,"path= set; remaining positionals join as query passed (3ms)
 path= alone without query raises passed (2ms)
  single-token recipe rejects multi positional passed (2ms)
   Direct bind covers empty known / zip fallback passed (1ms)","Pipeline","Multi-step chains",,"Pipeline","Multi-step chains","Named recipes"
"tests.test_coverage_gaps#test_settings_public_edges","settings: workspace path auto-root, api_key export, bad provider","passed","2ms",,,,"Test infrastructure","Coverage gaps",,"Test infrastructure","Coverage gaps",
"tests.test_tool_paths#test_sh_quote_embedded_quote","sh_quote escapes embedded single quotes","passed","1ms",,,,"Tool paths","Ripgrep resolution",,"Tool paths","Ripgrep resolution","Shell quoting"
"tests.test_tool_paths#test_sh_quote_safe","sh_quote leaves safe tokens unquoted","passed","0s",,,,"Tool paths","Ripgrep resolution",,"Tool paths","Ripgrep resolution","Shell quoting"
"tests.test_tool_paths#test_sh_quote_unsafe","sh_quote wraps unsafe characters","passed","0s",,,"quoted: 'file with spaces' passed (0s)","Tool paths","Ripgrep resolution",,"Tool paths","Ripgrep resolution","Shell quoting"
"tests.test_security#test_shell_args_quotes_metacharacters","Shell argument quoter escapes metacharacters","passed","0s",,,"Quote shell arguments with metacharacters passed (0s)
  dangerous arg: 'foo; rm -rf /' passed (0s)
  safe arg: safe-name passed (0s)
  spaced arg: 'two words' passed (0s)
 Verify quoting rules passed (0s)","Security","Shell quoting",,"Security","Shell quoting","Shell args"
